구분,학수번호,교과목명,학년,학기,필수선수,권장선수,실험실습,세부전공,학점,시간,전공역량,대학,학과,개설학과,내용,메모,개설횟수,sylla_eng,syllabus_kr
전공선택,KECE302,전자회로II,3,1.0,,,,,3,3,문제해결,공과대학,전기전자공학부,,전기전자공학부,,5,"The objective of this course is to learn about advanced electronic circuits using BJTs and MOSFETs, such as differential amplifier, frequency response of various amplifiers, and feedback circuits. Also, students will learn the power amplifier used for out","본 과목에서는 BJT 및 CMOS 기반 차동 증폭기 회로의 분석 및 설계 방식을 다루고, 여러 형태의 증폭기 회로의 주파수 응답의 원리를 익히며, 다양한 구조의 피드백 회로의 기본을 학습한다. 또한 출력단에 사용되는 전력 증폭기의 이론을 살펴보고, 다양한 유형의 연산 증폭"
전공선택,KECE304,전자회로설계및실험II,3,1.0,,,,,1,3,문제해결,공과대학,전기전자공학부,,전기전자공학부,,5,"The objective of this course is to perform the experiments with electronic circuits including differential amplifiers, frequency response, feedback circuits, power amplifiers, and operational amplifier-based circuits, and to learn the structure, operation","본 과목에서는 차동증폭기, 주파수 응답, 피드백 회로, 전력 증폭기, 연산 증폭기 회로 등의 전자회로에 대한 실험을 수행하며, 이를 통해 다양한 회로의 구조, 동작, 분석 방법을 학습한다. 또한 실험을 통해 전자회로를 직접 설계하고 측정하는 방법을 배운다.  "
전공선택,KECE316,데이터네트워크,3,1.0,,,,,3,3,문제해결,공과대학,전기전자공학부,,전기전자공학부,,5,"This introductory course covers the basic principles of data communication networks. The concept of OSI 7 layers model will be introduced, including network-dependent layers.","데이터 통신의 기본 개념의 이해를 목표로 한다. 데이터 통신 참조 모델인 OSI 7 계층에 대한 개요를 소개한 뒤, 특히 네트워크 계층 이하에 대한 주제를 상세히 다룰 것이다."
전공선택,KECE323,전자장,3,1.0,,,,,3,3,문제해결,공과대학,전기전자공학부,,전기전자공학부,,5,"Based on the Maxwell’s equations, on the conventional semiconductor devices, the new aspects on the nano-scale electronic devices will be introduced. In the class, the introduction of semiconductor physics, the operating principle and the applications of","Maxwell 방정식을 기초로 하여 시변 전자장 이론을 습득하고, 전자파(electromagnetic waves), 전송선(transmission lines), 도파로(waveguides), 안테나(antenna) 등의 원리와 응용의 기초를 배운다."
전공선택,KECE326,디지털통신,3,2.0,,,,,3,3,문제해결,공과대학,전기전자공학부,,전기전자공학부,,5,"Introduction to communication signal processing theory, baseband signal transmission, bandpass modulation and demodulation, communication link analysis, channel coding, digital synchronization, signal multiplexing and multiple access, spread spectrum comm","통신 신호처리 이론 개요, 기저대 신호 전송, 대역통과 변조 및 복조, 통신 링크 분석, 채널 코딩, 디지털 동기화, 신호 다중화 및 다중접속, 대역확산 통신 이론, 기타 디지털 통신 시스템 사례를 연구한다."
전공선택,KECE331,반도체공학I,3,1.0,,,,,3,3,문제해결,공과대학,전기전자공학부,,전기전자공학부,,5,"The key element of silicon VLSI and compound semiconductor MMIC are CMOS and MESFET, respectively. We will learn operation principle, analytic modeling theory of these two devices.","실리콘 집적회로의 필수 요소인 CMOS소자와 화합물 MMIC의 기본 소자인 MESFET 소자에 대해서 심도 있게 배운다. CMOS 소자의 동작 이론, analytic (SPICE) modeling, MESFET 소자의 동작이론, DC modeling에 대해서 강의한다."
전공선택,KECE334,반도체공학II,3,2.0,,,,,3,3,문제해결,공과대학,전기전자공학부,,전기전자공학부,,5,"This course takes the operation principle of the pn junction which is basic structure in semiconductor, bipolar transistor, MOS capacitor and MOSFET. We learn the elementary knowledge of the characteristics in the equilibrium state, analysis of the I-V ch","반도체 디바이스의 기본 구조인 PN접합과 이 접합으로 구성되는 양극성 트랜지스터, MOS 커패시터 그리고 MOSFET의 동작원리를 이해한다. 평형상태의 특성과 전류-전합 특성의 분석 및 모델링 방법 등 기본지식을 배운다. 또한 2차 효과의 원인과 개선법 등을 습득하여 반도 "
전공선택,KECE340,운영체제,3,2.0,,,,,3,3,문제해결,공과대학,전기전자공학부,,전기전자공학부,,4,"First, the basic concepts of the operating system will be explained. The following topics will then be discussed: process management, I/O management, memory management and file system management. In process management, process communication and process sc","운영체제의 기본개념을 간단히 설명한다. 다음에는 각 토픽에 해당하는 프로세스관리, 입출력관리, 메모리관리 및 파일시스템관리 등에 설명한다. 프로세스관리에는 프로세스통신, 프로세스 스케듈링 등을 다루며, 입출력 에는 데드록을 포함하여 램디스크, 클럭, 터미널 등 "
전공선택,KECE343,컴퓨터구조,3,1.0,,,,,3,3,문제해결,공과대학,전기전자공학부,,전기전자공학부,,5,"This course covers what computer is and how the computer performs tasks directed by instructions coded in a program. The topics covered include history of computing, information representation, instruction set architecture, computer arithmetic, central pr","각종 디지털 집적회로의 기능, 레지스터에서의 정보 전달과 마이크로 오퍼레이션, 컴퓨터의 전체적인 구조, 중앙처리장치의 구성, 마이크로프로그램 제어장치, 입출력 처리장치, 기억장치 등에 동작특성을 익힌다."
전공선택,KECE345,전기전자공학도를위한 기계학습과 지능,3,1.0,,,,,3,3,문제해결,공과대학,전기전자공학부,,전기전자공학부,,2,"This class introduces the basic theory of machine learning and intelligence and provides an opportunity to practice through programming. It also introduces  various learning models and parameter tuning techniques, extending to image and language recogniti","본 과목에서는 전기전자공학의 다양한 문제를 해결하기 위해 필요한 기본적인 기계학습과 인공지능의 이론을 학습하고 실제 프로그래밍을 통해 실습한다. 다양한 학습 모델과 모수 조정 기법 등을 학습하고, 영상 및 언어 인지로 확장하며, 이를 통해 반도체, 통신, 제어, 로"
전공선택,KECE346,전기전자공학도를위한 데이터과학,3,2.0,,,,,3,3,문제해결,공과대학,전기전자공학부,,전기전자공학부,,2,"This course introduces the basic of data science and provides an opportunity to practice through programming. It introduces various data exploring method, preprocessing, modeling and time-course analysis, and finally problem solving cases in electrical en","본 과목에서는 전기전자공학의 다양한 문제를 해결하기 위해 필요한 기본적인 데이터 과학의 기본을 학습하고 실제 프로그래밍을 통해 실습한다. 다양한 데이터 탐색, 전처리, 모델링, 시계열 분석 기법 등을 학습하고, 이를 통해 반도체, 통신, 제어, 로봇, 회로, 전기 에너"
전공선택,KECE359,전기에너지공학,3,1.0,,,,,3,3,문제해결,공과대학,전기전자공학부,,전기전자공학부,,0,This course introduces the fundamentals of electric energy systems and energy conversion and then covers fundamentals of traditional and future energy resources for zero carbon emissions. This course also includes hands-on practice of simulation tools for,"본 강의는 전기에너지시템과 에너지변환의 기초에 대해 다루고, 최근 탄소중립을 달성을 위해 고려되고 있는 기존 및 미래의 신에너지원의 개론을 다룬다. 또한 전기에너지공학 모의해석을 위한 시뮬레이션 실습을 포함한다."
전공선택,KECE361,전력공학I,3,1.0,,,,,3,3,문제해결,공과대학,전기전자공학부,,전기전자공학부,,5,"This class serves as an introduction to methods of analyzing power systems. The course covers  calculation of line parameters, representation of transmission lines and power components, and power flow control.","본 과목에서는 전력계통 해석을 위한 기본 지식, 선로정수 계산 및 전력조류 계산 등을 학습한다. "
전공선택,KECE362,전력공학II,3,2.0,,,,,3,3,문제해결,공과대학,전기전자공학부,,전기전자공학부,,4,"The course covers symmetrical components, power system fault analysis, system protection, power system controls, and power system stability.","본 과목에서는 대칭좌표법, 계통고장해석, 계통보호, 계통제어를 위한 유무효전력제어, 전력계통 안정도 및 동적 특성해석을 위한 기본 이론을 학습한다. "
전공선택,KECE364,전기기기I,3,2.0,,,,,3,3,문제해결,공과대학,전기전자공학부,,전기전자공학부,,5,"This class serves as an introduction to the basic construction, operating principles, and analysis of transformers and rotating dc and ac electric machines. For each type of electric machine, the terminal characteristics and performance are analyzed using","에너지 변환 및 제어기기인 다양한 종류의 전기기기들에 대하여 소개한다. 기기들의 구조, 동작원리, 등가회로에 의한 표현 및 해석을 통한 특성 및 성능 평가 방법을 학습한다"
전공선택,KECE370,디지털신호처리,3,2.0,,,,,3,3,문제해결,공과대학,전기전자공학부,,전기전자공학부,,5,"Discrete-time signals and systems, sampling, Z-transform, transform analysis of linear time-invariant systems, structures for discrete-time systems, filter design techniques, and the discrete Fourier transform and its computation are covered in this cours","신호 및 시스템의 기초, 샘플링, Z-변환, 선형 시불변 시스템의 변환분석, 이산 시스템의 구조, 필터 설계 기술, discrete 푸리에 변환 및 계산 방법에 대해 학습한다."
전공선택,KECE382,제어공학,3,2.0,,,,,3,3,문제해결,공과대학,전기전자공학부,,전기전자공학부,,5,"Feedback is discussed as a fundamental concept of automatic control._x000D_
Specifically, relations between the pole locations of a linear time-invariant system and its time-domain responses, stability, root-locus techniques, frequency responses, controller des","자동제어의 핵심 개념인 되먹임(Feedback)에 대해 공부한다. 이를 위해 연속시간 시불변 선형시스템의 극점 위치와 시간 응답특성의 관계, 안정도, 근궤적법, 주파수 특성, 제어기 설계 기법 등을 다룬다."
전공선택,KECE389,공학현장실습I,3,,,,,,3,0,,공과대학,전기전자공학부,,전기전자공학부,,0,,
전공선택,KECE399,공학현장실습II,3,,,,,,3,0,,공과대학,전기전자공학부,,전기전자공학부,,0,,
전공선택,KECE411,전기전자재료공학,4,1.0,,,,,3,3,융합적사고,공과대학,전기전자공학부,,전기전자공학부,,5,"This course provides fundamental properties and materials structures of metals, alloys, semiconductors, insulators, dielectic, ferroelectric and magnetic materials for applications of electrical and electronic devices. It also introduces basic knowledges ","전기전자소자에 적용되는 각종 금속과 합금, 반도체, 절연체, 유전체, 강유전체, 자성체 등의 기본 물성과 재료적 구조에 대한 내용을 배우고, 이러한 전기전자재료를 적용하는 다양한 전자소자와 부품에 대한 기본 지식과 응용기술에 대하여 학습한다. "
전공선택,KECE413,분산병렬컴퓨팅,4,1.0,,,,,3,3,융합적사고,공과대학,전기전자공학부,,전기전자공학부,,1,This class introduces the basic theory of Parallel Processing and Distributed Systems and provides an opportunity to practice through programming. The course provides students with the knowledge and experience to utilize multiple CPUs or GPUs and also com,"본 과목에서는 전기전자공학의 다양한 문제를 해결하기 위해 필요한 기본적인 병렬처리, 분산시스템 이론을 학습하고 실제 프로그래밍을 통해 실습한다. 구제척으로는 다수의 CPU 또는 GPU, 네트워크로 연결된 클러스터를 사용하여 빠른 계산속도를 위한 이론과 실제를 학습 "
전공선택,KECE414,정보기억소자,4,2.0,,,,,3,3,융합적사고,공과대학,전기전자공학부,,전기전자공학부,,3,"This subject provides primary concepts, operation principles and fabrication of memory devices based on semiconductor devices in a basic level, and then introduces the essential operations of volatile and nonvolatile memory devices achieved by dielectric,","반도체 소자를 기반으로 하는 정보기억소자의 기본 개념과 동작원리 그리고 제작 방법에 대하여 기본적인 수준으로 학습하고, 물질의 유전체 특성, 자기적 특성 및 광학적 특성을 활용한 정보기억소자의 동작원리와  이들 소자의 비휘발성 메모리 특성을 배운다. 이와 더불어"
전공선택,KECE415,나노전자공학,4,1.0,,,,,3,3,융합적사고,공과대학,전기전자공학부,,전기전자공학부,,4,"This course covers a basic concept and fundamental structures of future nanoscale electronic devices, molecular devices, quantum devices and bio-electronic devices based on diverse nanostructured materials, which are quite different from conventional sili","기존의 실리콘이나 화합물반도체와 다른 새로운 개념의 다양한 나노물질을 이용하는 차세대 극미세 전자소자, 분자소자, 양자소자 그리고 바이오전자소자에 대한 기본 개념과 구조를 배우고, 이러한 차세대 나노소자의 구조와 동작특성 그리고 제작하는 방법에 대한 기본지식"
전공선택,KECE416,정보디스플레이,4,2.0,,,,,3,3,융합적사고,공과대학,전기전자공학부,,전기전자공학부,,3,"This subject covers basic properties and operation principles of electronic devices and components which are applied to information displays. It deals with operation principles and fabrication methods of divers information displays, and also introduces te"," 전기전자분야의 핵심기술인 정보디스플레이에 적용되는 전자소자와 부품에 대한 기본적인 물성과 동작특성에 관한 내용을 배운다. 또한 정보디스플레이의 동작특성과 제작방법에 대한 내용을 배우고, 차세대 정보디스플레이 기술의 동향과 전망에 대하여 학습한다."
전공선택,KECE418,멀티미디어신호처리,4,2.0,,,,,3,3,융합적사고,공과대학,전기전자공학부,,전기전자공학부,,1,We learn fundamental and mathematical signal processing theories for a variety of multimedia systems. Special focus is placed on statistical signal estimation and optimization techniques.,"다양한 멀티미디어 시스템에 적용되는 기초적이고 수학적인 신호처리 이론을 학습하며, 특히 통계적 예측 및 최적화 이론을 중심으로 학습한다."
전공선택,KECE419,전기기기II,4,1.0,,,,,3,3,융합적사고,공과대학,전기전자공학부,,전기전자공학부,,1,"This class serves as an advanced course for the analysis of ac electric machines, which included three phase and single phase induction, synchronous motors and generators.","단상 및 3상 유도 전동기, 동기 전동기 및 발전기 등의 교류 전기기기의 동작원리 및 해석에 대하여 심도 있게 다룬다. "
전공선택,KECE421,정보및부호화이론,4,1.0,,,,,3,3,융합적사고,공과대학,전기전자공학부,,전기전자공학부,,5,"This course deals with the principles and applications of information and coding theory, which forms the basis of the modern theory of communications. This includes how information is measured in terms of probability and entropy; how such information is u","이 과목은 현대 통신 이론의 기초가 되는 정보 및 부호화 이론의 원리와 응용에 대하여 공부한다. 정보가 확률 및 엔트로피의 관점에서 어떻게 정량화될 수 있는지를 알아보고, 잡음이 존재하는 경우와 존재하지 않는 경우에 대하여, 정보량을 사용하여 통신채널의 용량을 계"
전공선택,KECE422,통신시스템설계,4,2.0,,,,,3,4,융합적사고,공과대학,전기전자공학부,,전기전자공학부,,1,"This course deals with design principles and techniques of the basic building blocks consisting of analog and digital communication systems. Topics covered include design of oscillators, filters, PLL, equalizers, and modulators and demodulators for AM, FM","이 과목은 아날로그 및 디지털 통신시스템을 구성하는 기본적인 구성 블록들의 설계원리 및 기법들을 다루며, 오실레이터, 필터, 등화기 및 AM, FM, PM, BPSK, QPSK, QAM 등에 관한 변복조 회로 등에 관한 설계를 공부한다."
전공선택,KECE423,통신네트워크설계,4,1.0,,,,,3,3,융합적사고,공과대학,전기전자공학부,,전기전자공학부,,4,"This introductory course will provide a basic knowledge of optical communication systems and networks. Optical signal transmission via optical fiber, laser diode and optical transmitter, photodiode and optical receiver, performance evaluation of optical t","광통신공학의 기초 이론과 실제 응용사례를 공부한다. 광섬유의 광신호 전송원리, laser diode 및 송신기, photodiode 및 수신기, 송수신 시스템 성능 평가, coherent 광통신 방식, WDM 광통신 방식, 광통신 네트워크 설계, 광섬유 증폭기 등 기타 광통신 소자에 대해 학습한"
전공선택,KECE424,안테나공학,4,2.0,,,,,3,3,융합적사고,공과대학,전기전자공학부,,전기전자공학부,,2,This course emphasizes practical aspect of RF engineering by combining basic field and circuit theories from prerequisite courses. Students carry out circuit component analysis using commercial software packages. Understand the specialized terms related t,RF 및 통신 HW 분야의 주요 부품인 안테나를 이해하기 위해 회로와 필드를 결합한 이론학습. 통신용 회로 설계 및 필드 분석 프로그램 소개. 안테나 관련 기본 특성 용어 이해 및 다양한 안테나에 대한 작동원리 분석
전공선택,KECE425,이동통신공학,4,1.0,,,,,3,3,융합적사고,공과대학,전기전자공학부,,전기전자공학부,,5,"This course covers the technologies to overcome fading channel and to enhance spectrum efficiency such as fading channel characteristics, channel equalizer techniques, channel estimation techniques, and multi-user communication systems. ","디지털 통신 기술을 바탕으로 사용자가 이동하면서 발생하는 통신 채널의 변화를 극복하며, 또한 주파수 자원을 많은 사용자가 효율적으로 공유할 수 있는 기술 등을 다룬다. 페이딩 채널의 특성, 페이딩 채널 극복 기법, 채널 추정 기법, 다중 사용자 통신 시스템 등의 내용"
전공선택,KECE432,전자신소재공학,4,2.0,,,,,3,3,융합적사고,공과대학,전기전자공학부,,전기전자공학부,,1,,
전공선택,KECE440,광전자공학,4,2.0,,,,,3,3,융합적사고,공과대학,전기전자공학부,,전기전자공학부,,1,"This course will cover the basic concepts of compound semiconductors using optoelectronic devices and will include topics such as optics effect, wave guiding, wave propagation, modulation and the operating principles and application of the optical communi","광전자 소자에 사용되는 화합물 반도체 전반에 대한 기본 개념과 Wave guiding, wave propagation 등의 광학 및 광전효과(electro optic effect)에 대하여 강의하고, 이를 기초로 한 광전자소자(LED, Laser Diode, Photo detector, Optical Modulator, Optical Switch, 광 집"
전공선택,KECE437,RF공학,4,1.0,,,,,3,3,융합적사고,공과대학,전기전자공학부,,전기전자공학부,,2,"This course introduces the fundamentals of RF and microwave circuits for wireless communications. Covered topics include wireless system fundamentals, transmission lines, impedance matching, and RF/microwave circuit design including amplifiers, oscillator","무선통신, 레이더와 같은 무선 응용 시스템 구성에 필수적인 RF 및 마이크로파 회로 설계의 기본 원리를 학습함. 무선 통신 시스템의 개요, 전송선 이론, 임피던스 매칭, RF 소자 및 RF 능동회로(증폭기, 발진기, 혼합기 등)의 동작 원리와 기본적인 설계 기법을 익힘으로써 "
전공선택,KECE438,기초양자전자공학,4,2.0,,,,,3,3,융합적사고,공과대학,전기전자공학부,,전기전자공학부,,3,"The quantum mechanical approaches for the semiconductor devices will be introduced with the detail concepts, philosophical & physical ideas and some practical applications such as band theory, p-n junction, laser, etc. In the class, the historical develop","반도체 소자이론의 근간을 이루는 양자역학적인 해석에 대해 소개하여 양자전자공학의 기초를 마련한다. 본 수업에서는 밴드이론, p-n 접합다이오드, 레이저 등의 실용화된 소자 등에 대한 이해를 할 수 있도록 수학적 모델을 포함한 양자역학의 기본부터 근본적으로 접근하 "
전공선택,KECE445,데이터베이스,4,1.0,,,,,3,3,융합적사고,공과대학,전기전자공학부,,전기전자공학부,,5,"The topics covered in this course are: database system architecture, relational data base, object-oriented data base, and data models.","본 강의는 대량의 데이터를 저장하고 검색하며, 조작할 수 있는 데이터베이스의 기본 개념 및 이론, 응용 기술을 습득시키는 데 그 목적이 있다. 특히, 단순히 개념만을 다루는 것이 아니라, 데이터베이스 응용 시스템의 구현 기술에 대하여 심도있게 다룸으로서 앞으로 더  "
전공선택,KECE447,객체지향프로그래밍,4,1.0,,,,,3,3,융합적사고,공과대학,전기전자공학부,,전기전자공학부,,1,"This course introduces the basic concepts of object-oriented programming with C++. The detail features of C++, class, inheritance, template, and standard library, will be covered. It also includes practical tips for developing software solutions. ","본 과목에서는 C++를 사용한 객체 지향 프로그래밍의 기본 개념을 소개한다. C++, 클래스, 상속, 템플릿 및 표준 라이브러리의 세부 기능을 다루고, 소프트웨어 솔루션 개발을 위한 실용적인 팁도 설명한다. "
전공선택,KECE448,플랫폼프로그래밍,4,2.0,,,,,3,3,융합적사고,공과대학,전기전자공학부,,전기전자공학부,,0,"This course let students learn fundamental computing and Internet platforms that must be used to solve various problems in electrical and electronic engineering, and understand their structure through application programming using them. Based on various p",본 과목에서는 전기전자 공학의 다양한 문제를 해결하기 위해 활용해야 하는 기본적인 컴퓨팅 및 인터넷 플랫폼에 대해 학습하고 이를 활용한 응용 프로그래밍을 통해 그 구조를 이해한다. 각종 플랫폼을 기반으로 하드웨어 및 소프트웨어의 상호 작용의 기본 원리를 학습하 
전공선택,KECE449,컴퓨터네트워크,4,1.0,,,,,3,3,융합적사고,공과대학,전기전자공학부,,전기전자공학부,,5,"Topics include ISO 7 Layer, physical layer, link layer, network layer, transport layer, session layer, presentation layer, and their applications. Also, existing protocol for each layer, the protocol description and verification method, as well as multime","ISO 7 Layer 계층인 물리계층, 링크계층, 네트워크계층, 트랜스포트 계층, 세션계층, 표현계층, 응용계층 등의 개념을 배운 다음 각 계층의 실제의 프로토콜이 어떤 것이 있는지 하나씩 예를 들면서 설명한다. 또한 프로토콜 기술방법 및 검증방법 등을 배우며 이를 응용하여"
전공선택,KECE450,신재생에너지,4,2.0,,,,,3,3,융합적사고,공과대학,전기전자공학부,,전기전자공학부,,3,"General characteristics of renewable energy resources are explained, and requirement for integration of renewable energy resources to power systems are studied. Simulation studies for power system analysis are also required.",다양한 신재생에너지원의 특성을 학습하고 신재생에너지원을 전력계통에 연계하기 위해 요구되는 기술적인 사항을 학습하고 실습을 통해 이해한다.
