구분,학수번호,교과목명,학년,학기,필수선수,권장선수,실험실습,세부전공,학점,시간,전공역량,대학,학과,개설학과,내용,메모,개설횟수,sylla_eng,syllabus_kr
전공선택,KECE452,에너지관리시스템,4,2.0,,,,,3,3,융합적사고,공과대학,전기전자공학부,,전기전자공학부,,4,Basic theory for large-scale system analysis is covered. Also system analysis using commercial tools and application of analysis techniques to electric power systems are included. Design projects of controlling system voltage and frequency in real system ,기간산업의 핵심인 전기에너지 시스템의 경제적이며 동시에 안전한 운용을 위한 기반기술을 해석적인 방법과 실제 계통 적용을 통해 공부한다. 전력산업 구조개편으로 도입된 전력거래시장에 적용되는 신에너지관리시스템의 기능에 대한 소개 및 현장방문을 통하여 이해를 증
전공선택,KECE456,코드및시스템최적화,4,2.0,,,,,3,3,융합적사고,공과대학,전기전자공학부,,전기전자공학부,,4,"This course introduces the concept and structure of a compiler and code optimization on a computer system. The course covers all the compiler passes such as scanner, parser, IR, calling convention, register allocation, instruction generation and schedulin","컴파일러의 기본 구조와 scanner, parser, IR, calling convention, register allocation, instruction 생성 및 코드 최적화 구성요소의 동작 원리를 학습함. 또한 CPU/GPU, 메모리 및 운영체제를 고려한 다양한 코드 최적화 기법에 대하여 학습함으로써 실무적 능력을 배양 "
전공선택,KECE457,전력경제,4,1.0,,,,,3,3,융합적사고,공과대학,전기전자공학부,,전기전자공학부,,3,"Economic structure of power systems. Problem formulation, optimization methods and programming for economic analysis of power system operation and planning. Economic dispatch, load forecasting, unit commitment, interchange, planning and reliability analys","? 전력계통 운용 및 계획의 경제 해석을 위한 최적화 및 프로그래밍 ? 경제급전, 부하예측, 신뢰도 평가"
전공선택,KECE458,배전공학,4,2.0,,,,,3,3,융합적사고,공과대학,전기전자공학부,,전기전자공학부,,2,"This course covers fundamental theory and application technology regarding power distribution. The topics include distribution system planning, load characteristics, distribution transformers, degisn of subtranmission lines and distribution substations, p","본 강의에서는 배전계통에 대한 기본이론과 응용기술에 대해 다룬다. 세부내용에는 배전계획, 부하특성, 배전변압기, 배전변전소, 급전선, 전압제어, 배전보호, 신뢰도, 분산전원, 마이크로그리드, 스마트그리드 등이 포함된다."
전공선택,KECE461,아날로그집적회로,4,1.0,,,,,3,3,융합적사고,공과대학,전기전자공학부,,전기전자공학부,,5,"LSI/VLSI design and fabrication processes are studied. VLSI design, layout, and timing simulation tools are introduced, and various design introductions such as CMOS-amplifier, OP-Amp, Advanced OP-Amp, and data converter will be studied. ","고밀도 집적회로의 제조공정을 이해하고 컴퓨터를 이용한 회로설계, 레이아웃, 타이밍, 검증 등에 대해서 연구하여 이에 따른 CAD Tool의 사용 방법과 programming 방법을 익히고 CMOS-Amplifier, OP-Amp, Data Converter의 기초 등을 학습한다."
전공선택,KECE462,ASIC설계,4,2.0,,,,,3,3,융합적사고,공과대학,전기전자공학부,,전기전자공학부,,2,"This lecture introduces the design technologies of ASICs and it’s characteristic improvements based on the theories of the bipolar and MOS devices. In addition, a Trade-Off in the analog circuit design will be discussed in detail. This course also includ",Bipolar Device 및 MOS 소자이론과 IC 특론에서 익힌 기초이론을 토대로 ASIC의 설계기법과 특성 향상책 수립을 위한 설계기술상의 문제점에 관한 분석을 주로 강의한다. 아울러 Analog Circuit Design에서 제기되는 Trade-Off에 관하여서도 심도 있게 취급하며 실제 CMOS de
전공선택,KECE463,VLSI설계및실험,4,1.0,,,,,3,4,융합적사고,공과대학,전기전자공학부,,전기전자공학부,,5,"Students can have a chance to deal with various digital systems, and learn how to use various CAD tools. This course finally covers the hardware implementation of systems through design, simulation and synthesis with using CAD tools.","현재 issue가 되고 있는 각종 디지털 시스템을 접하고 VLSI 설계를 위한 다양한 CAD tool 이용방법을 익히며 CAD tool을 이용하여 시스템을 설계하고, 모의실험, 합성과정을 통해 하드웨어로 구현하는 것이 이 교과목의 학습 목표이다."
전공선택,KECE470,패턴인식,4,2.0,,,,,3,3,융합적사고,공과대학,전기전자공학부,,전기전자공학부,,4,"Pattern recognition concepts, Bayesian decision theories, classification, clustering, feature extraction, supervised and unsupervised training, and applications to speech, audio, image and video recognition systems.","패턴인식의 개념, Bayesian 결정론, 분류 이론, 클러스터링, 특징 추출 기법, 머쉰 학습 등의 이론과 음성, 음향, 영상 패턴 인식 시스템에 대한 응용을 학습한다."
전공선택,KECE471,컴퓨터비젼,4,1.0,,,,,3,3,융합적사고,공과대학,전기전자공학부,,전기전자공학부,,5,"We learn key concepts and topics in computer vision, such as binary image analysis, edge detection, segmentation, object tracking, pyramidal image representation, stereo and motion.","컴퓨터비젼의 기본 개념과 원리를 다룬다. 구체적 세부 주제는 이진 영상 분석, 에지 검출, 세그멘테이션, 물체 추적, 피라미드 영상 표현, 스테레오와 움직임 분석을 포함한다."
전공선택,KECE480,로봇공학개론,4,2.0,,,,,3,3,융합적사고,공과대학,전기전자공학부,,전기전자공학부,,3,"This course covers introductory topics of robotics. It includes basic mathematical theories, real robotics applications, and hand-on experiences. Major topics are robot kinematics, robot dynamics, sensing, actuation, control architectures, world represent","본 과목은 로봇 공학 입문 과목으로, 로봇 공학을 위한 수학적 기초 이론을 학습하고, 구체적 응용 예제들을 탐구하며, 수업시간에 다루어진 내용을 실험, 실습을 통해 구현해 보는 과목이다. 본 과목에서 배우게 될 주요 내용들은 로봇 기구학, 로봇 동역학, 센싱 및 구동, "
전공선택,KECE483,메카트로닉스,4,1.0,,,,,3,3,융합적사고,공과대학,전기전자공학부,,전기전자공학부,,3,"Mechatronics concerns intelligent systems built using technologies from areas of electrical, mechanical and control engineering. Principles and techniques are learned on how to build mechatronics systems using microprocessors.","메카트로닉스는 전기전자, 기계, 제어 기술이 통합하여 구현된 지능적인 기계시스템에 관한 분야이다. 마이크로마우스나 로봇축구에 쓰이는 소형 로봇과 같은 예를 중심으로 마이크로프로세서를 이용하여 메카트로닉스 시스템을 설계하는 기술을 습득한다."
전공선택,KECE484,지능시스템,4,2.0,,,,,3,3,융합적사고,공과대학,전기전자공학부,,전기전자공학부,,0,,
전공선택,KECE492,무선네트워크,4,2.0,,,,,3,3,융합적사고,공과대학,전기전자공학부,,전기전자공학부,,4,"Study of communications networks pertaining to data communications, network architecture, performance measures. Case study includes existing local area network, cellular mobile communications network and wireless data network (e.g., wireless LAN/PAN).","실제 통신망의 구현 사례를 중심으로 데이터 통신, 네트워크의 설계 및 구현, 그리고 성능 분석 방안에 대해 이해한다. LAN, 셀룰러 이동 통신망, 무선 LAN/무선 PAN 등의 무선 데이터 네트워크 등에 대한 관련 이론적 배경을 이해하고 실제 구현 형태에 대해 고찰한다."
전공선택,KECE493,반도체프로세스,4,1.0,,,,,3,3,융합적사고,공과대학,전기전자공학부,,전기전자공학부,,5,This course introduces the basic processes common to most IC technologies and provides a base for understanding more advanced processing and design courses. The scope of this course is limited to the material related only to silicon processing and packagi,"본 과목에서는 대부분의 집적회로(IC) 제작에 공통인 공정기술들을 소개하여 더높은 수준의 공정과 설계 과목을 이해하기 위해 필요한 기반을 제공한다. 이 과목의 범위는 실리콘 공정 및 패키징에 관련된 내용으로만 국한하지만, VLSI/ULSI 공정에 관련된 최근 문제점들도  "
전공선택,KECE495,전력전자공학,4,1.0,,,,,3,3,융합적사고,공과대학,전기전자공학부,,전기전자공학부,,4,"Power electronics may be defined as the applications of solid-state electronics for the control and conversion of electric power. The characteristics of switching devices, design and analysis of circuits for conversion of electric power - converter, inver","전력전자공학은 반도체소자를 전력의 변환과 제어에 응용하는 분야이다. 반도체 스위칭소자들의 특성. 반도체소자를 이용한 전력변환회로 -컨버터, 인버터, 교류전압제어기 및 직류전압 제어기등-의 설계와 해석을 다룬다."
전공선택,KECE496,디지털집적회로,4,2.0,,,,,3,3,융합적사고,공과대학,전기전자공학부,,전기전자공학부,,5,"This introductory course covers digital integrated circuits. Based on an understanding of semiconductor devices and its circuits, many methods in designing VLSI circuit are treated. Also, CMOS digital circuits (switch and protection circuit, inverters and","이 과정은 전자회로와 반도체 소자의 이해를 기반으로 디지털 VLSI 회로를 디자인하는 방법을 다룬다. 주로 CMOS 디지털 회로(switch and protection circuit, inverters and buffers, static logic circuit, dynamic logic circuit, arithmetic circuits, ROM, RAM)의 이해 "
전공선택,KECE453,디지털제어,4,1.0,,,,,3,3,융합적사고,공과대학,전기전자공학부,,전기전자공학부,,0,,
전공선택,KECE499,디지털영상처리,4,1.0,,,,,3,3,융합적사고,공과대학,전기전자공학부,,전기전자공학부,,4,"Image fundamentals, image transforms, image enhancement, image restoration, image compression, image segmentation, image representation, image recognition and their interpretation.","디지털 영상의 기본 개념, 영상 변환, 영상화질 개선, 영상 복구, 영상 압축, 영상 분할, 영상 표현, 영상 인식 및 이해를 목표로 한다."
전공인정,EGRN230,국제공학인턴쉽Ⅲ,2,,,,,,9,0,,공과대학,전기전자공학부,,전기전자공학부,,0,This Internship benefits include developing personally and professionally while working companies abroad to second and third year students during vacation. Students are able to apply theoretical principles into real-world. Students are expected to accumul,"4학년 학생을 대상으로 정규 학기 중에 해외에 소재한 기업 또는 기관에서 강의실에서 배운 이론적인 지식을 현장에서 적용하도록 한다. 해외 진출에 따른 실무적인 준비, 현지 생활, 해당국 어학 및 타국 문화이해 증진 등의 다양한 경험을 쌓도록 한다"
전공인정,EGRN332,기술과창업,3,,,,,,3,3,,공과대학,전기전자공학부,,전기전자공학부,,1,,
전공인정,EGRN430,공학인턴십I,4,,,,,,6,0,,공과대학,전기전자공학부,,전기전자공학부,,3,This Internship gives senior students the opportunity to integrate theory learned in the classroom with practical application and skills development.,인턴쉽프로그램을 통해 수업에서 배운 이론을 실제로 적용하는 기회를 제공한다.
전공인정,EGRN440,공학인턴십II,4,,,,,,9,0,,공과대학,전기전자공학부,,전기전자공학부,,3,This internship is to provide opportunities to senior students that they can apply theoretical principles and practical techniques to real-world through participating in various engineering fields such as high-tech industry and R&D.,인턴쉽프로그램을 통해 R&D 분야와 같은 다양한 공학 현장에서 이론과 기술적 사항들을 실제 적용하는 기회를 제공한다.
